[
  {
    "id": "6c2f294104c8",
    "domain": "General",
    "question": "A company makes forecasts each quarter to decide how to optimize operations to meet expected demand. The company uses ML models to make these forecasts. An AI practitioner is writing a report about the trained ML models to provide transparency and explainability to company stakeholders. What should the AI practitioner include in the report to meet the transparency and explainability requirements?",
    "options": {
      "A": "Code for model training",
      "B": "Partial dependence plots (PDPs)",
      "C": "Sample data for training",
      "D": "Model convergence tables"
    },
    "correct": "B",
    "explanation": "Correct answer is B.",
    "source": "amazon-ai-practitioner-questions 3.html",
    "tags": [],
    "added": "2026-06-02"
  },
  {
    "id": "d311499498eb",
    "domain": "General",
    "question": "A law firm wants to build an AI application by using large language models (LLMs). The application will read legal documents and extract key points from the documents. Which solution meets these requirements?",
    "options": {
      "A": "Build an automatic named entity recognition system.",
      "B": "Create a recommendation engine.",
      "C": "Develop a summarization chatbot.",
      "D": "Develop a multi-language translation system."
    },
    "correct": "C",
    "explanation": "Correct answer is C.",
    "source": "amazon-ai-practitioner-questions 3.html",
    "tags": [],
    "added": "2026-06-02"
  },
  {
    "id": "664cc3e4f8f7",
    "domain": "General",
    "question": "A company wants to classify human genes into 20 categories based on gene characteristics. The company needs an ML algorithm to document how the inner mechanism of the model affects the output. Which ML algorithm meets these requirements?",
    "options": {
      "A": "Decision trees",
      "B": "Linear regression",
      "C": "Logistic regression",
      "D": "Neural networks"
    },
    "correct": "A",
    "explanation": "Correct answer is A.",
    "source": "amazon-ai-practitioner-questions 3.html",
    "tags": [],
    "added": "2026-06-02"
  },
  {
    "id": "faa6533d69e2",
    "domain": "General",
    "question": "A company has built an image classification model to predict plant diseases from photos of plant leaves. The company wants to evaluate how many images the model classified correctly. Which evaluation metric should the company use to measure the model's performance?",
    "options": {
      "A": "R-squared score",
      "B": "Accuracy",
      "C": "Root mean squared error (RMSE)",
      "D": "Learning rate"
    },
    "correct": "B",
    "explanation": "Correct answer is B.",
    "source": "amazon-ai-practitioner-questions 3.html",
    "tags": [],
    "added": "2026-06-02"
  },
  {
    "id": "4c48bb438aaf",
    "domain": "General",
    "question": "A company is using a pre-trained large language model (LLM) to build a chatbot for product recommendations. The company needs the LLM outputs to be short and written in a specific language. Which solution will align the LLM response quality with the company's expectations?",
    "options": {
      "A": "Adjust the prompt.",
      "B": "Choose an LLM of a different size.",
      "C": "Increase the temperature.",
      "D": "Increase the Top K value."
    },
    "correct": "A",
    "explanation": "Correct answer is A.",
    "source": "amazon-ai-practitioner-questions 3.html",
    "tags": [],
    "added": "2026-06-02"
  },
  {
    "id": "7265b2bc262a",
    "domain": "General",
    "question": "A company uses Amazon SageMaker for its ML pipeline in a production environment. The company has large input data sizes up to 1 GB and processing times up to 1 hour. The company needs near real- time latency. Which SageMaker inference option meets these requirements?",
    "options": {
      "A": "Real-time inference",
      "B": "Serverless inference",
      "C": "Asynchronous inference",
      "D": "Batch transform"
    },
    "correct": "C",
    "explanation": "Correct answer is C.",
    "source": "amazon-ai-practitioner-questions 3.html",
    "tags": [],
    "added": "2026-06-02"
  },
  {
    "id": "033647b66d67",
    "domain": "General",
    "question": "A company is using domain-specific models. The company wants to avoid creating new models from the beginning. The company instead wants to adapt pre-trained models to create models for new, related tasks. Which ML strategy meets these requirements?",
    "options": {
      "A": "Increase the number of epochs.",
      "B": "Use transfer learning.",
      "C": "Decrease the number of epochs.",
      "D": "Use unsupervised learning."
    },
    "correct": "B",
    "explanation": "Correct answer is B.",
    "source": "amazon-ai-practitioner-questions 3.html",
    "tags": [],
    "added": "2026-06-02"
  },
  {
    "id": "b39dfec7e3bb",
    "domain": "General",
    "question": "A company is building a solution to generate images for protective eyewear. The solution must have high accuracy and must minimize the risk of incorrect annotations. Which solution will meet these requirements?",
    "options": {
      "A": "Human-in-the-loop validation by using Amazon SageMaker Ground Truth Plus",
      "B": "Data augmentation by using an Amazon Bedrock knowledge base",
      "C": "Image recognition by using Amazon Rekognition",
      "D": "Data summarization by using Amazon QuickSight Q"
    },
    "correct": "A",
    "explanation": "Correct answer is A.",
    "source": "amazon-ai-practitioner-questions 3.html",
    "tags": [],
    "added": "2026-06-02"
  },
  {
    "id": "df8b1c51c0bd",
    "domain": "General",
    "question": "A company wants to create a chatbot by using a foundation model (FM) on Amazon Bedrock. The FM needs to access encrypted data that is stored in an Amazon S3 bucket. The data is encrypted with Amazon S3 managed keys (SSE-S3). The FM encounters a failure when attempting to access the S3 bucket data. Which solution will meet these requirements?",
    "options": {
      "A": "Ensure that the role that Amazon Bedrock assumes has permission to decrypt data with the correct encryption key.",
      "B": "Set the access permissions for the S3 buckets to allow public access to enable access over the internet.",
      "C": "Use prompt engineering techniques to tell the model to look for information in Amazon S3.",
      "D": "Ensure that the S3 data does not contain sensitive information."
    },
    "correct": "A",
    "explanation": "Correct answer is A.",
    "source": "amazon-ai-practitioner-questions 3.html",
    "tags": [],
    "added": "2026-06-02"
  },
  {
    "id": "d7665253b72c",
    "domain": "General",
    "question": "A company wants to use language models to create an application for inference on edge devices. The inference must have the lowest latency possible. Which solution will meet these requirements?",
    "options": {
      "A": "Deploy optimized small language models (SLMs) on edge devices.",
      "B": "Deploy optimized large language models (LLMs) on edge devices.",
      "C": "Incorporate a centralized small language model (SLM) API for asynchronous communication with edge devices.",
      "D": "Incorporate a centralized large language model (LLM) API for asynchronous communication with edge devices."
    },
    "correct": "A",
    "explanation": "Correct answer is A.",
    "source": "amazon-ai-practitioner-questions 3.html",
    "tags": [],
    "added": "2026-06-02"
  },
  {
    "id": "066d3fa8777c",
    "domain": "General",
    "question": "A company wants to build an ML model by using Amazon SageMaker. The company needs to share and manage variables for model development across multiple teams. Which SageMaker feature meets these requirements?",
    "options": {
      "A": "Amazon SageMaker Feature Store",
      "B": "Amazon SageMaker Data Wrangler",
      "C": "Amazon SageMaker Clarify",
      "D": "Amazon SageMaker Model Cards"
    },
    "correct": "A",
    "explanation": "Correct answer is A.",
    "source": "amazon-ai-practitioner-questions 3.html",
    "tags": [],
    "added": "2026-06-02"
  },
  {
    "id": "4a7430c7ec80",
    "domain": "General",
    "question": "A company wants to use generative AI to increase developer productivity and software development. The company wants to use Amazon Q Developer. What can Amazon Q Developer do to help the company meet these requirements?",
    "options": {
      "A": "Create software snippets, reference tracking, and open source license tracking.",
      "B": "Run an application without provisioning or managing servers.",
      "C": "Enable voice commands for coding and providing natural language search.",
      "D": "Convert audio files to text documents by using ML models."
    },
    "correct": "A",
    "explanation": "Correct answer is A.",
    "source": "amazon-ai-practitioner-questions 3.html",
    "tags": [],
    "added": "2026-06-02"
  },
  {
    "id": "d6c8cf281be4",
    "domain": "General",
    "question": "A financial institution is using Amazon Bedrock to develop an AI application. The application is hosted in a VPC. To meet regulatory compliance standards, the VPC is not allowed access to any internet traffic. Which AWS service or feature will meet these requirements?",
    "options": {
      "A": "AWS PrivateLink",
      "B": "Amazon Macie",
      "C": "Amazon CloudFront",
      "D": "Internet gateway"
    },
    "correct": "A",
    "explanation": "Correct answer is A.",
    "source": "amazon-ai-practitioner-questions 3.html",
    "tags": [],
    "added": "2026-06-02"
  },
  {
    "id": "88db0be1994a",
    "domain": "General",
    "question": "A company wants to develop an educational game where users answer questions such as the following: \"A jar contains six red, four green, and three yellow marbles. What is the probability of choosing a green marble from the jar?\" Which solution meets these requirements with the LEAST operational overhead?",